author,author_link,date,title
Derek Haynes,https://scoutapm.com/blog/author/derek-haynes,"July 25, 2013",Understanding CPU Steal Time - when should you be worried?
Doug Breaker,https://scoutapm.com/blog/author/doug-breaker,"August 28, 2013",Docker: Git for deployment
Andre Lewis,https://scoutapm.com/blog/author/andre-lewis,"May 10, 2011",The Short and Sweet SSL How-to
Andre Lewis,https://scoutapm.com/blog/author/andre-lewis,"February 01, 2010",Production Server Sysadmin Essentials
Doug Breaker,https://scoutapm.com/blog/author/doug-breaker,"September 13, 2019",Understanding page faults and memory swap-in/outs: when should you worry?
Special contributor to Scout APM,https://scoutapm.com/blog/author/special-contributor-to-scout-apm,"May 24, 2022",4 Best Practices for Root Cause Analysis
